,title,date,news_url,image_url,category,contetns
78,"이재명, 대우조선소 찾아 ""구조조정 우려 막아야""",6시간전	,https://news.naver.com/main/read.naver?mode=LSD&mid=sec&sid1=100&oid=448&aid=0000343914,https://imgnews.pstatic.net/image/origin/448/2021/11/14/343914.jpg?type=ofullfill106_72,100,"여야 대선주자들도 이번 대선 승부를  가를 수 있는  핵심 부동층인  청년 표심을 잡기 위해 전력을 집중하고 있습니다. 부울경 지역을 순회중인 더불어민주당 이재명 후보는 MZ 세대 연구원들과 퀴즈쇼를 하며 소통행보를 이어갔습니다.  노사 갈등을 겪고 있는 대우조선과 지역 공공병원도 찾았습니다. 한국항공우주산업 앞에 선 '매주타는 민생버스'에 이재명 후보와 청년 연구원들이 올라탔습니다. 항공·우주 분야에 대한 퀴즈쇼가 진행됐고, ""아 이렇게 수준낮게, 수·금·지·화·목·토·천·해·명, 그런데 명(왕성)은 별이 아니라면서요 최근?"" 전날밤 거제 캠핑장에서 30대 연인들과 함께 '차박 캠핑' 형태로 간담회를 진행한 데 이어 연일 청년 민심 다가서기에 나선 겁니다. 대우조선해양 인수 합병 문제로 노사가 갈등을 빚는 대우조선소에선 노조 측의 목소리를 들었습니다. ""즉흥적인 약속은 않겠지만, 구조조정 과정에서 억울한 피해는 없도록 최선을 다하겠다""고 한 이 후보는 이후 경영진을 만난 자리에서 ""문제는 불신""이라고 짚었습니다. ""문제는 아까 얘기한대로 불신이에요, 불신. 노동자들에 대한 구조조정이 대대적으로 이뤄져서 일자리를 잃지 않겠냐…"" 첫 버스 민생투어를 부울경 지역에서 소화한 이 후보는 이후 충청권 등 지역으로 이어가며 국토균형발전과 같은 현안에 집중할 전망입니다. "
79, 군 코로나19 확진자 5명 늘어...전원 돌파감염,6시간전	,https://news.naver.com/main/read.naver?mode=LSD&mid=sec&sid1=100&oid=052&aid=0001665000,https://search.naver.com/search.naver?where=image&sm=tab_jum&query=naver#,100,"확진자들은 공군 군무원 1명, 해병대 병사 2명, 해병대 간부 1명, 육군 간부 1명으로 모두 4개 부대에서 산발적으로 나왔습니다. 추가 확진자 5명 모두 예방접종을 마치고 2주가 지난 뒤에 양성 판정을 받은 돌파감염 사례입니다. 이로써 지금까지 군 내 누적 확진자는 2천123명이고, 이가운데 돌파감염자는 417명입니다. "
80,"與, '종부세 전면 재검토' 尹에 ""한마디로 부자본색""",6시간전	,https://news.naver.com/main/read.naver?mode=LSD&mid=sec&sid1=100&oid=277&aid=0004999242,https://imgnews.pstatic.net/image/origin/277/2021/11/14/4999242.jpg?type=ofullfill106_72,100,"민주당 을지로위원장인 진성준 의원은 이날 페이스북에서 ""윤 후보가 국민의 1.7%에 해당하는 집부자, 땅부자를 위한 종부세 감면론을 제기했다""며 이같이 밝혔다. 진 의원은 ""날로 심각해지는 자산 불평등과 격차에 대한 눈곱만큼의 문제의식조차 찾아볼 수 없고, 노블레스 오블리주라는 사회적 책임의식도 느낄 수 없는 불의한 주장""이라며 ""오로지 극소수 땅부자 집부자들과 기득권 언론의 환심을 사려는 것""이라고 주장했다. 이어 ""윤 후보는 집값 폭등에 절망하고 분노하는 2030 청년과 신혼부부, 무주택 서민들의 처지를 짐작이나 하느냐""며 ""그들의 고통을 조금이라도 이해한다면 부동산 부자 감세론을 즉각 철회하기 바란다""고 말했다. 신동근 의원도 페이스북에서 ""윤 후보 주장대로라면 다주택자 등 부동산 부자들이 부동산을 갖는 것에 부담을 느낄 이유가 없다""며 ""토건족들이 기승을 부릴 완벽한 여건이 조성된다""고 비판했다. 신 의원은 ""윤 후보가 꿈꾸는 나라라는 게 고작 부동산 부자들의 천국이란 말이냐""며 ""부동산을 잡기는커녕 무주택자 등 부동산 취약계층을 잡을 것""이라고 주장했다. 앞서 윤 후보는 이날 페이스북에서 ""대통령이 되면 종부세를 전면 재검토할 것""이라면서 ""종부세를 재산세에 통합하거나 1주택자에 대해서는 면제하는 방안을 검토하겠다""고 밝혔다. "
81,"[백브리핑] 이재명 부인 김혜경 ""뭉클""…진중권 ""신파""",6시간전	,https://news.naver.com/main/read.naver?mode=LSD&mid=sec&sid1=100&oid=437&aid=0000280788,https://imgnews.pstatic.net/image/origin/437/2021/11/14/280788.jpg?type=ofullfill106_72,100,"이재명 민주당 대선 후보, 매주 타는 버스, 줄여서 매타버스 타고 이번 주말 부산, 울산, 경남 돌았습니다. [이재명 : 원래는 영상통화로 어떻게 해볼까 그랬는데, 지금 이렇게 꼬매가지고 안돼요. 제가 때려가지고 그렇다는 소문이 있다면서요. 어처구니가 없어가지고.] 그리고 '예비부부에게 조언을 해달라'는 말에 '다쳐보니 옆에서 손 잡아주는 남편이 든든하더라…'라면서 이 말을 했습니다. [김혜경 : 제가 잠시 기절을 했었는데, 눈을 딱 뜨는 순간에 우리 남편이요. '이 사람아' 하면서 막 울고 있는 거에요. (굉장히 무뚝뚝 하시던데) 상상이 안 가시죠 여러분? 그래서 사실 아 좀 되게 뭉클했어요.] ""아내의 사고마저 '자상한 남편' 이미지 홍보할 기회로 활용하려드니 가식적이라는 느낌을 준다"" 꽤 세게 비판을 했네요. [네. 119입니다. 무엇을 도와드릴까요? 여보세요. 지금 빨리 앰뷸런스 부탁드립니다. (무슨 일이신데요?) 지금 토사곽란에다가 얼굴이 찢어져가지고 응급실 가야 됩니다.] 악성 루머는 차단을 하고 또 구급대원 VIP 보고 논란도 있었던 만큼 누군지 밝히지 않고 '대선 후보임에도 일반 시민의 자세로 신고했다'는 걸 강조하려는 거겠죠. [허경영 : 안녕하십니까, 허경영 대통령 후보입니다. 코로나로 얼마나 힘드십니까. 대한민국의 미래를 바꾸기 위한 첫 걸음은 용기있는 투표입니다. 허경영 대통령 후보였습니다. 감사합니다.] 허경영씨는 작년 총선 때도 여기 저기서 전화 받았다는 분들 나오면서 실시간 검색어 오르기도 했습니다. 여론조사 참여해서 정확한 국민 마음 보여주는 것도 중요하긴 한데, 이게 또 불편하게 느껴지면 받지 않거나 끊는 것도 또한 권리일 수도 있겠죠. "
82,"[영상] 이재명 ""내가 아내 폭행?""…진중권 ""아내 사고마저 홍보기회 삼나""",6시간전	,https://news.naver.com/main/read.naver?mode=LSD&mid=sec&sid1=100&oid=421&aid=0005722987,https://imgnews.pstatic.net/image/origin/421/2021/11/14/5722987.jpg?type=ofullfill106_72,100,"(서울=뉴스1) 정수영 기자 = 진중권 전 동양대학교 교수가 이재명 더불어민주당 대선후보 측이 부인 김혜경씨 낙상 사고를 이미지 홍보용으로 활용하고 있다며 ""가식적이다""라고 비판했다. 진 전 교수는 14일 자신의 페이스북에 ""이 후보 캠프의 문제는 모두 인위적으로 느껴진다는 것이다. 아내의 사고마저 '자상한 남편' 이미지를 홍보할 기회로 활용하려 든다""라며 이같이 말했다. 앞서 이 후보는 지난 13일 경남 거제 옥계해수욕장 오토캠핑장에서 열린 예비부부와 함께하는 '명심캠프' 토크쇼 현장에서 아내 김씨에게 전화를 걸었다. 이 후보는 ""원래 영상통화로 하려고 했는데 얼굴을 꿰매서""라면서 ""제가 때려서 그렇다는 소문이 있던데 어처구니가 없다""라고 했다. 김씨는 ""이번에 사고가 있어 다쳐보니 옆에서 손잡아주는 남편이 있다는 게 너무 든든한 것 같다""면서 ""제가 잠시 기절을 했는데 눈을 딱 뜨는 순간 남편이 '이 사람아' 하면서 울고 있었다. 되게 뭉클했다""라고 말했다. 이 후보도 ""밤에 침대에 누워 있는데 이 사람이 화장실을 가더니 갑자기 비명소리 비슷하게 나고 쾅 소리가 났다""며 ""'이 사람 가면 어떡하지', 살아온 인생이 갑자기 떠올랐다. 너무 불쌍하고, 고생만 하고""라며 당시 상황을 설명했다. 한편 이 후보는 9일 김씨가 낙상사고로 병원에 입원하면서 당일 예정됐던 일정을 전면 취소했다. 이에 김씨의 입원 이유가 이 후보의 폭행 때문이라는 소문이 퍼졌다. 이 후보 측은 소방서와 병원 측으로부터 받은 자료와 119구급차 CCTV 화면 등을 공개하며 소문을 일축했다. "
83,정부 '요소수 늑장대처' 한 달…靑 파장 예의주시,6시간전	,https://news.naver.com/main/read.naver?mode=LSD&mid=sec&sid1=100&oid=422&aid=0000513950,https://imgnews.pstatic.net/image/origin/422/2021/11/14/513950.jpg?type=ofullfill106_72,100,"정부는 뒤늦게 급한 불은 껐지만, 부실 대응 비판의 불똥이 더 번지진 않을까 예의주시하고 있습니다. 한 달 전 예고된 중국의 요소 수출 제한. 정부가 사태의 심각성을 알고 움직인 것은 한참 뒤였습니다. <이태규 / 국민의당 의원(지난 11일)> ""아무 문제가 없다는 오판을 했습니다, 중국 대사관에서. 중국 측 조치가 어떻게 될 지에 대해 외교부가 전혀 파악하지 못하다는 것이 이번에 드러났거든요?"" <정의용 / 외교부 장관(지난 11일)> ""외교부뿐 아니라 정부 내 관련된 모든 부처가 이러한 문제에 대해 다시 한번 총점검하고 있습니다."" <유영민 / 대통령 비서실장(지난 10일)> ""좀 더 일찍 우리가 이런 것을 예견하고 준비를 해왔더라면 하는 아쉬움은 있습니다. 비싼 수업료 냈다고 생각하겠습니다. 좋은 전화위복, 예."" 최근 청와대가 경제수석을 7개월 만에 교체한 배경도 요소수 책임론과 무관하지 않다는 평가입니다. 최근 여론조사에서 문 대통령 국정 수행에 대한 부정 평가가 3주 연속 늘어난 것으로 나타났습니다. 정부가 요소를 속속 확보하며 급한 불은 끄고 있지만, 유통 과정에서 현장 혼선은 계속되는 상황. 청와대는 요소수에서 촉발된 정부 책임론이 임기 말 국정 동력을 떨어뜨리진 않을지, 그 파장을 예의주시하고 있습니다. "
84,“경남에 부당한 일 막겠다” PK해결사로 나선 이재명…“재미없다” 발언 도마에,6시간전	,https://news.naver.com/main/read.naver?mode=LSD&mid=sec&sid1=100&oid=025&aid=0003150628,https://imgnews.pstatic.net/image/origin/025/2021/11/14/3150628.jpg?type=ofullfill106_72,100,"이재명 더불어민주당 대선 후보가 2박 3일 부산·울산·경남(PK) 방문 일정의 마지막 날인 14일, 경남 지역 산업 현장을 훑으며 PK 민심 확보에 총력을 기울였다. 이 후보는 이날 오전 이 지역 최대 현안 중 하나인 현대중공업의 대우조선해양 인수·합병 문제와 관련해 노사를 잇달아 만났다. 그는 먼저 거제 대우조선소 정문 앞에서 농성 중인 노조를 만나 “지역 주민들 입장에선 현대중공업 중심으로 경영이 되면 대우조선 관련 기업을 홀대하지 않을까 그런 걱정(이 있는 것)”이라며 “거제, 경남이 현대중공업으로부터 부당하게 홀대받는 일을 막을 방안을 찾아보겠다”고 했다. 이어 이성근 대우조선해양 대표이사 등 경영진을 만난 이 후보는 “합병 효과 자체는 국제 경쟁력이 올라서 대한민국 조선 산업 전체가 좋아지는 혜택이 있다”면서도 “ 이날 이 후보는 “일단 진행 중인 합병 절차를 어떻게 하겠다고 즉흥적으로 말하는 건 무책임하다”며 시종일관 조심스러운 입장을 보였다. 다만 이 후보는 “정치계에선 ‘이해관계가 충돌하는 현장에는 가지 말고 피하라’는 게 좋지 않은 전통인데, (제) 생각은 다르다”며 “이해관계가 충돌해도 사람이 만든 문제기 때문에 얼마든지 지혜로, 양보로, 타협으로 길을 찾아낼 수 있다”고 말했다. 당내에선 “난제도 풀어낼 수 있는 후보의 실행력과 협상력을 강조한 일정”(선대위 관계자)이라는 해석이 나왔다. 이날 노조 측은 이 후보에게 “지난 3년 당사자들의 외침에 정부도 민주당도 아무런 응답이 없었다. 오로지 정부가 결정하면 따라갈 수밖에 없다는 게 민주당 방침이었다”(신태호 노조 수석부위원장)며 정부·여당에 대한 실망감을 쏟아냈다. “문재인 대통령도 후보 시절 거제에 수차례 와 ‘매각 안 하겠다’고 약속했었다. 그 거짓말에 시민들이 받은 배신감과 충격이 이루 말할 수 없다”(강학도 거제경실련 집행위원장)는 표현도 나왔다. 이에 이 후보는 “(거제는 문 대통령) 본인 고향인데, 해결할 수 있는 길을 피했겠나. 안 돼도 하려고 노력했을 것”이라며 문 대통령을 옹호하면서도 “노력은 했는데 결과를 제대로 못 만든 건 공적 책임을 지는 거니까 책임을 묻는 건 타당하다”고 말했다. 이 후보는 또 “이 후보도 약속하고 안 지킬 거 아니냐는 걱정은 안 해도 된다. 확신이 안 서면 약속 안 한다”면서도 “지킬 수 있을지 없을지 모르는데 약속해서 희망 고문을 하진 않는다”라고도 했다. 문재인 정부에 대한 비판에 이 후보가 대신 답변하는 모습은 오후 일정에서도 반복됐다. 이 후보는 이날 오후 경남 사천 한국항공우주산업(KAI) 직원들과의 간담회에서 ‘문재인 정부가 공약한 노동이사제가 이행되지 않았다’는 노조 측 지적에 “해야 한다고 생각한다. 어려운 일도 아니지 않으냐”고 답했다. 이 후보는 특히 노동이사제에 대해 “경기도 산하기관은 다 해놓았다. (노동자에) 이사 자격을 부여하고 의사결정 과정에 참여하게 하는 게 뭐가 문제냐”고 말했다. 이 후보가 전국 민생 탐방 프로젝트인 ‘매타버스’(매주 타는 민생버스) 첫 행선지로 PK를 택한 건 이 지지율이 낮은 탓이 크다. 엠브레인퍼블릭·케이스탯리서치·코리아리서치·한국리서치 등 4개 여론조사기관 여론조사(지난 8~10일)에 따르면, 이 후보는 PK에서 27% 지지율을 얻어 46%를 기록한 윤석열 국민의힘 대선 후보에 19%포인트 뒤처졌다. PK는 이 후보(24%)가 윤 후보(56%)보다 32%포인트 낮았던 대구·경북(TK) 지역 다음으로 지지율이 가장 크게 뒤진 지역이었다. (※자세한 사항은 중앙선거여론조사심의위 참조) 이 후보의 PK 광폭 행보에 대해, 야당은 “부산은 재미없잖아”라는 이 후보의 전날 발언을 문제 삼았다. 이 후보는 전날 부산 스타트업·소셜벤처 대표들과 간담회에서 지역 균형발전의 필요성을 설명하던 중 “부산은 재미없잖아, 솔직히”라고 말한 뒤, “재미있긴 한데 강남 같지 않은 측면이 있는 것”이라고 덧붙였다. 이를 두고 이날 야당에선 “부산을 폄훼한 발언”(김병민 윤석열 대변인), “부산이 우습게 보이나?”(박수영 국민의힘 의원) 등 비판이 이어졌다. 이런 공격에 대해 이소영 민주당 선대위 대변인은 “이 후보는 지역 균형발전의 필요성을 언급하고, ‘청년들이 살고 싶어 모여드는 부산’을 만들기 위해 필요한 노력에 대해 발언했다”며 “국민의힘은 이 후보 발언을 왜곡하며 지역 비하, 지역 폄훼 논란으로 변질시키고 있다”고 반박했다. "
85,"與, ‘종부세 재검토’ 尹 겨냥 “땅·집부자 환심 사려는 것”",7시간전	,https://news.naver.com/main/read.naver?mode=LSD&mid=sec&sid1=100&oid=081&aid=0003229834,https://imgnews.pstatic.net/image/origin/081/2021/11/14/3229834.jpg?type=ofullfill106_72,100,"더불어민주당은 14일 윤석열 국민의힘 대선후보가 종부세를 전면 재검토하겠다고 밝힌 데 대해 “한마디로 부자본색”이라고 맹비난했다. 윤 후보는 이날 페이스북에서 “대통령이 되면 종부세를 전면 재검토할 것”이라면서 “종부세를 재산세에 통합하거나 1주택자에 대해서는 면제하는 방안을 검토하겠다”고 밝혔다. 민주당 을지로위원장인 진성준 의원은 이날 페이스북에서 “윤 후보가 국민의 1.7%에 해당하는 집부자, 땅부자를 위한 종부세 감면론을 제기했다”며 이같이 밝혔다. 진 의원은 “날로 심각해지는 자산 불평등과 격차에 대한 눈곱만큼의 문제의식조차 찾아볼 수 없고, 노블레스 오블리주라는 사회적 책임의식도 느낄 수 없는 불의한 주장”이라며 “오로지 극소수 땅부자 집부자들과 기득권 언론의 환심을 사려는 것”이라고 주장했다. 그러면서 “윤 후보는 집값 폭등에 절망하고 분노하는 2030 청년과 신혼부부, 무주택 서민들의 처지를 짐작이나 하느냐”며 “그들의 고통을 조금이라도 이해한다면 부동산 부자 감세론을 즉각 철회하기 바란다”고 말했다. 신동근 의원도 페이스북에서 “윤 후보 주장대로라면 다주택자 등 부동산 부자들이 부동산을 갖는 것에 부담을 느낄 이유가 없다”며 “토건족들이 기승을 부릴 완벽한 여건이 조성된다”고 비판했다. 신 의원은 “윤 후보가 꿈꾸는 나라라는 게 고작 부동산 부자들의 천국이란 말이냐”며 “부동산을 잡기는커녕 무주택자 등 부동산 취약계층을 잡을 것”이라고 주장했다. "
86,"[단독] 한기호 국민의힘 사무총장, 이준석 대표에 사의",7시간전	,https://news.naver.com/main/read.naver?mode=LSD&mid=sec&sid1=100&oid=023&aid=0003652937,https://imgnews.pstatic.net/image/origin/023/2021/11/14/3652937.jpg?type=ofullfill106_72,100,한기호 국민의힘 사무총장이 이준석 당대표에게 사의를 밝힌 것으로 14일 알려졌다. 이 대표는 지난 6월 당대표에 선출된 후 3선인 한 의원을 당 사무총장에 임명했다. 이 대표는 한 총장 사의에 즉답을 하지는 않은 것으로 알려졌다. 한 총장은 이날 본지 통화에서 “이준석 대표에게 사무총장 자리와 관련해 나 때문에 고민하지 말라는 뜻을 전했다”며 “이제 내 거취는 내 손을 떠난 일”이라고 했다. 이 대표는 한 총장에게 사의를 수리할지 명확한 입장을 밝히지 않은 것으로 알려졌다. 국민의힘 관계자는 “한 총장은 자신을 임명한 이 대표 입장을 감안하면서 대선을 치러야 하는 윤석열 후보에게 선택권을 주기 위해 거취를 이 대표에게 일임한 것으로 보인다”라고 했다. 윤 후보는 지난 5일 후보로 선출된 후 이 대표에게 당 사무총장을 새 인물로 교체하자는 뜻을 전했다. 당 사무처를 이끌며 당의 인사·조직·재정 업무를 총괄하는 사무총장에 자기와 호흡이 맞는 인물을 새로 임명하겠다는 뜻이었다. 윤 후보 측 인사는 “후보가 당의 뒷받침을 받고 대선을 치르기 위해 적어도 대선 기간엔 후보와 뜻이 맞는 인사가 사무총장을 맡는 게 순리”라고 했다. 다만 이 대표는 한 총장이 임명된 지 넉달밖에 안 된 만큼 좀 더 상황을 지켜보자는 입장이었던 것으로 알려져 한 총장 사의를 수리할 지는 좀 더 지켜봐야 한다는 관측이 나온다. 
87,부동산 표심 겨눈 尹 “종부세 전면 재검토”,7시간전	,https://news.naver.com/main/read.naver?mode=LSD&mid=sec&sid1=100&oid=081&aid=0003229829,https://imgnews.pstatic.net/image/origin/081/2021/11/14/3229829.jpg?type=ofullfill106_72,100,"윤석열 국민의힘 대선후보는 14일 “종합부동산세를 재산세에 통합하거나 1주택자에 대해서는 면제하는 방안을 검토하겠다”며 종부세 제도 전면 개편을 공약했다. 윤 후보는 페이스북에 “국민의 급격한 보유세 부담 증가를 해소하고 양도소득세 세율을 인하해 기존 주택의 거래를 촉진하고 거래 안정을 유도할 것”이라며 “공시가격 인상 속도를 낮춰 보유세가 급증하는 것을 막겠다. 1세대 1주택자에 대한 세율도 인하하고 장기보유 고령층 1세대 1주택자에 대해서는 매각하거나 상속할 때까지 납부를 유예하는 제도를 검토하겠다”고 밝혔다. 윤 후보의 공약은 오는 22일부터 올해분 종부세 고지서가 발송될 예정인 가운데 나왔다. 윤 후보는 “1주택 보유자들 중에는 수입이 별로 없는 고령층도 있다. 더구나 코로나 사태로 소득이 정체되거나 줄어든 사람도 많은데, 이런 분들이 어떻게 고액의 세금을 감당할 수 있느냐”고 반문했다. 이에 대해 더불어민주당 핵심 관계자는 “집권여당으로서 종부세 기준을 공시가 9억원에서 11억원으로 완화해 부유세의 본래 취지에 맞도록 부과 대상을 줄였다”며 “재산세 인하 적용 대상도 공시가 6억원에서 9억원으로 상향하는 등 할 수 있는 것은 다 했다”고 말했다. 윤 후보와 국민의힘이 종부세 전면 개편의 ‘감세카드’를 들고 나온 가운데 여권을 중심으로는 양도소득세 개편 논의가 본격화되고 있다. 국회 기획재정위원회는 15일 조세소위를 열고 양도세 개편안을 담은 소득세법 개정안을 논의할 예정이다. 핵심은 1가구 1주택 양도세가 비과세되는 고가주택 기준을 현행 9억원에서 12억원으로 높이는 내용이다. 민주당은 기존 양도 차익 규모와 상관없이 40%로 일괄 적용되던 공제율을 보유 기간에 따라 10~40%까지 차등 적용하는 1가구 1주택자의 장기보유특별(장특)공제율을 변경하는 내용도 당론으로 추진하고 있다. 국민의힘 등 야당은 장특공제율 차등 부과에는 이견이 있지만 양도세 완화라는 큰 틀에 공감하고 있어 연내 처리 가능성이 큰 상황이다. "
88,이재명 부인 “기절 뒤 눈 뜨니 남편 막 울고 있었죠”,7시간전	,https://news.naver.com/main/read.naver?mode=LSD&mid=sec&sid1=100&oid=081&aid=0003229828,https://imgnews.pstatic.net/image/origin/081/2021/11/14/3229828.jpg?type=ofullfill106_72,100,"이재명 더불어민주당 대선후보의 부인 김혜경씨가 “기절했다가 눈을 떠 보니 남편이 막 울고 있었다”며 낙상 사고 당시 상황을 전했다. 김씨의 낙상 사고 이후 인터넷에 유포된 의혹 등을 불식시키고 부부 금실을 강조하기 위한 것으로 풀이된다. 14일 민주당에 따르면 이 후보는 지난 13일 경남 거제시 옥계 해수욕장 오토캠핑장에서 열린 지역 예비부부와 함께하는 ‘명심캠프’ 토크쇼에서 김씨에게 깜짝 전화 연결을 했다. 한 참석자가 김씨에게 “다친 데는 괜찮냐”고 묻자 김씨는 “괜찮다. 여러분에게 심려를 끼쳐 드려 죄송하다”고 답했다. 이어 “제가 잠시 기절을 했다가 눈을 딱 뜨는 순간에 우리 남편이 ‘이 사람아’라며 막 울고 있었다”면서 “되게 뭉클했다. 다쳐 보니 옆에서 손잡아 주는 남편이 있다는 게 든든하다”고 전했다. 이 후보도 “밤에 이 사람이 화장실을 갔는데 갑자기 쾅 소리가 났다”면서 “(아내가) 정신 잃고 있었다. 살아온 인생이 갑자기 떠오르며 너무 불쌍하고, 고생만 하고…”라고 회상했다. 이어 낙상 사고와 관련해 “내가 때렸다는 소문이 있잖아. 너무 어처구니가 없어서…”라며 웃기도 했다. 그는 “그건 누가 일부러 한 것”이라며 “몇 시간 만에 전국 소셜네트워크서비스(SNS)에 뿌려졌다”고도 했다. 박찬대 민주당 선거대책위원회 수석대변인은 지난 13일 브리핑에서 “조직적인 유언비어 대량 살포는 민주주의에 대한 심각한 도전”이라며 “대선판에 부정선거, 구태정치의 망령이 다시 살아나는 것을 결코 묵과하지 않고 모든 수단을 동원해 이들을 단죄할 것”이라고 밝혔다. "
