,title,date,news_url,image_url,category,contetns
48,"[정치톡톡] 김혜경의 ""자기야"" / 부산 비하 논란 / 야구와 대선 / 킹크랩 잡는 크라켄 / 홍준표의 '청년의꿈'",5시간전	,https://news.naver.com/main/read.naver?mode=LSD&mid=sec&sid1=100&oid=057&aid=0001621373,https://imgnews.pstatic.net/image/origin/057/2021/11/14/1621373.jpg?type=ofullfill106_72,100,"네, 최근 두 사람의 관계에 대한 이런저런 루머를 불식시키려는 듯 화기애애한 대화 모습을 보여줬는데요. - ""제가 잠시 기절을 했었는데 눈을 딱 뜨는 순간에 우리 남편이요 '이 사람아'하면서 막 우는 거예요."" 이 후보는 자신이 김 씨를 때렸다는 루머가 있었다는 얘기를 하면서 어처구니가 없었다고 말하기도 했습니다. 네, 이재명 후보가 직접 119에 신고한 음성파일을 공개했습니다, 같이 들어보시겠습니다. 네 어제, 부산지역 스타트업 대표와 사회적 벤처기업인들을 만난 자리에서 한 말이 논란이 된 건데요, 먼저 들어보시겠습니다. - ""부산 재미없잖아 솔직히…재미있는데 예를 들면 강남 같지 않은 측면이 있는 거예요. 젊은이들은 똑같은 조건이면 서울로 가고 싶어하고…."" 부산 재미 없고, 강남 같지 않은 면이 있다는 이 발언을 야권에서는 부산 비하 발언이라고 날을 세웠는데요. 국민의힘 소속인 박형준 부산시장은 ""재미없어서 죄송하다, 부산에 표 달라고 온 분이 재미없다고 해서 놀랐다""고 비꼬았고요. 윤석열 후보 측에서는 과거 이해찬 전 대표의 ""부산은 올 때마다 초라하다"" 발언 논란 등을 꺼내며 '비하 DNA'라고 비판했습니다. 민주당은 수도권으로 청년 인재가 유출된다는 고충에 이 후보가 공감한 건데 지역 비하로 변질시키고 있다고 반박했습니다. 윤석열 국민의힘 대선 후보는 오늘 프로야구 한국시리즈를 관람했다고 전했는데, 많이 익숙한 모습인 거 같아요? 야구장은 아니지만 이재명 후보는 이틀 전 고 최동원 선수를 주제로 한 다큐멘터리를 관람했었습니다. 아무래도 많은 국민이 즐기는 스포츠인만큼 나도 똑같은 한 명의 스포츠팬, 시민으로서 친근한 이미지를 주기 위한 거라는 해석이 많습니다. 실제 지난 대선 때는 안철수 후보가 부산 사직구장에서, 유승민 후보는 딸 유담 씨와 함께 대구 삼성라이온즈 경기를 관람하기도 했죠. 국민의힘 얘기로 가보죠, 이준석 대표가 오늘 '크라켄'이란 걸 공개했다면서요 이게 뭔가요? 일단 크라켄이라는 이름은 사진에서 보시는 것처럼 과거 뱃사람들이 두려워했다는 전설 속 바다괴물에서 따온 겁니다. 이준석 대표는 과거 드루킹이 만든 댓글조작프로그램인 '킹크랩'을 잡겠다는 의미라고 소개했는데요. 댓글조작 징후가 포착되면 AI로 사전에 잡아내는 조기경보프로그램이라면서 다 잡아낼 자신 있으니 민주당에 조심하라고 경고 메시지를 보냈습니다, 들어보시겠습니다. - ""민주당에서도 이번 대통령 선거에서는 절대 어쭙잖은 여론공작이나 매우 민주주의에 중대한 도전인 민심왜곡에 투자하는 건 포기할 걸 권합니다."" 아직은 비공개지만 조만간 윤 후보를 지원하기 위한 비단주머니 2호도 공개하겠다고 말했습니다. 청년들이 궁금한 점, 하고 싶은 말을 하면 홍 의원이 직접 답을 하는 건데 하루도 안 돼 수백 개의 글이 달릴 정도로 반응이 뜨거웠습니다. 실제 한 이용자가 선대위에 참여할 건지를 묻자 홍 의원은 ""당원으로서 선대위에 참여할 것""이라고 직접 답글을 달기도 했습니다. "
49,"국민의힘, 댓글조작 막는 `크라켄` 가동",5시간전	,https://news.naver.com/main/read.naver?mode=LSD&mid=sec&sid1=100&oid=029&aid=0002706042,https://imgnews.pstatic.net/image/origin/029/2021/11/14/2706042.jpg?type=ofullfill106_72,100,"국민의힘이 내년 대선을 앞두고 친(親)여권 성향 온라인 여론조작 프로그램 '드루킹' 가동을 막기 위한 '크라켄' 프로그램을 14일 선보이고, 이날부터 본격 가동에 돌입했다고 밝혔다. 작게는 민주당이 지난 대선에서 드루킹 댓글 조작사건을 일으켰던 점을 상기시키고, 크게는 윤석열 대선후보와 이준석 당대표가 '원팀'으로 움직여 사이버 여론전에서 우위를 차지하려는 의도로 해석된다. 이준석 국민의힘 대표는 이날 국회에서 댓글 조작 모니터링 프로그램인 '크라켄'을 공개 시연하면서 ""민주당도 이번 대선에선 절대로 어쭙잖은 여론 공작이나 민심 왜곡에 대해 투자하는 것을 포기하라""고 말했다. 이 대표는 ""북한의 탄도미사일 위협에 대응하기 위해 미사일 방어 체계인 패트리엇 미사일이나 사드 미사일, 레이더를 배치하는 것과 마찬가지로, (댓글 여론 조작에도) 조기 경보 시스템을 도입해야 한다는 취지""라고 말했다. 이 대표가 이날 시연한 프로그램 '크라켄'은 신화 속 바다 괴물 이름에서 따왔다. 지난 대선에서 댓글을 조작한 '드루킹' 일당의 프로그램인 '킹크랩'과 유사한 프로그램이 다시 가동되지 않도록 잡아내겠다는 의미다. 지난 대선에서 '드루킹' 김동원씨 일당은 네이버 등에 댓글을 달아 여권에 유리한 여론을 조성한 후 대가를 정권에 요구했고, 당시 김경수 경남도지사는 이들에게 오사카·센다이 총영사직을 제안하기도 했다. 이에 '크라켄'은 인터넷에서 주요 키워드에 관련된 기사와 댓글 정보를 자동으로 수집한 후, 인공지능(AI) 기반의 이상 행위를 자동으로 분석해 리포트를 작성하도록 설계됐다. 또 운영인력(크라켄 팀)이 직접 여론조작 의심 댓글과 IP를 수사기관에 신고하겠다는 게 국민의힘 측 설명이다. 국민의힘은 이달까지 시범 운영하고, 내달 1일부터는 대선 캠프 사무실에 프로그램 운영을 위한 공간을 마련키로 했다. 신율 명지대학교 정치외교학과 교수는 ""(크라켄 가동은 여론조작) 장난을 하지 말라는 일종의 경고""라며 ""국민의힘이 윤 후보를 지키겠다는 의미도 있을 것""이라고 말했다.한편 '크라켄'은 이 대표가 윤 후보에게 준 '첫 번째 비단 주머니'다. 소설 '삼국지연의'에서는 촉나라 책사 제갈량이 군주인 유비가 오나라를 방문하기 전 유비를 수행하는 조운에게 '위기의 순간이 닥치거든 꺼내 읽어보고 행동에 옮기라'며 묘책이 담긴 비단 주머니 3개를 건넸다. "
50,"""우리가 언론, 진실 알리자""‥""여론조작 지령"" 반발",5시간전	,https://news.naver.com/main/read.naver?mode=LSD&mid=sec&sid1=100&oid=214&aid=0001159872,https://imgnews.pstatic.net/image/origin/214/2021/11/14/1159872.jpg?type=ofullfill106_72,100,"이재명 후보 측은 김혜경 씨의 입원과 관련해 가짜 뉴스가 난무하고 있다며 119신고 당시 녹음 내용을 공개했는데요. 보수 언론들이 각종 왜곡 보도를 일삼고 있다면서 지지자들에게 직접 진실을 알리자고 호소했습니다. 김혜경씨 응급이송과 관련해 민주당 선대위가 공개한 이재명 후보의 119 신고 당시 녹음파일입니다. 이 후보측은 구급차내 CCTV 사진과 신고 기록을 공개했는데도 가짜뉴스들이 난무해 개인정보를 제외한 신고녹음까지 공개했다고 밝혔습니다. 보수언론이 대장동 의혹은 부풀리는데 반해 윤석열 후보 관련 의혹 보도는 거의 안 한다는 건데, ""언론 환경이 매우 나빠서 우리는 잘못한 것이 없어도, 잘못했을지도 모른다는 소문으로 도배가 됩니다. 우리가 언론사가 되어야 합니다."" 이준석 대표는 지난 대선 드루킹 사건처럼 이번에도 여론조작 시도가 있을 것이라며 댓글조작을 잡아내는 프로그램을 선보였습니다. ""본인의 지지자에게 댓글을 달라고 종용하는 등 여러 가지 민심 왜곡 시도가 있을 것으로 보여지는데, 저는 사실 대선 후보의 행보치고는 굉장히 행보가 자잘하고…"" 국민의힘은 이재명 후보가 부산 지역 기업인 간담회에서 '부산은 재미없다, 재미있긴 한데 강남 같지는 않다'고 말한 것과 관련해서도, 지역 비하 발언이라고 비판했습니다. 민주당은 청년 인재 유출을 막고 지역 균형 발전을 이루기 위해 고민하자는 내용을 왜곡하지 말라며, 국민의힘은 부산을 떠나는 청년을 위해 무엇을 했냐고 되물었습니다. "
51,"靑 “文정부, 청년정책 뼈대 세워…다음 정부는 더 나아가길”",5시간전	,https://news.naver.com/main/read.naver?mode=LSD&mid=sec&sid1=100&oid=005&aid=0001484163,https://imgnews.pstatic.net/image/origin/005/2021/11/14/1484163.jpg?type=ofullfill106_72,100,"박수현 청와대 국민소통수석은 14일 “문재인정부는 청년정책의 본격 추진을 위한 뼈대를 세우고 제도화했다”며 “이를 바탕으로 다음 정부의 청년정책이 두 걸음 더 나아가기를 바란다”고 밝혔다. 박 수석은 이날 페이스북에 ‘브리핑에 없는 대통령 이야기’ 24번째 시리즈를 올리고 “문재인정부의 청년정책은 역대 정부와 대비했을 때 일자리정책을 포괄해 청년의 삶 전반을 보듬는 보편적, 포괄적 정책으로 전환했다”고 강조했다. 박 수석은 현 정부의 청년정책 성과를 차례로 열거했다. 문재인정부는 지난해 2월 최초로 청년기본법을 제정했다. 이에 따라 청년과 청년정책의 개념이 법적으로 명문화됐다. 이번 정부 들어 박 수석은 “그동안 청년정책이 고용 문제에 집중돼 청년의 다양한 욕구를 충족하는 데 미흡했다”며 “문재인정부는 최초로 청년정책 비전과 방향 및 일자리·주거·교육·복지·문화 분야별 중점과제 등을 담은 제1차 청년정책 5개년 기본계획을 수립해 미래 청년정책의 초석을 마련했다”고 자평했다. 박 수석은 308개의 청년정책 시행계획 사업에 대한 정량적 분석 결과도 함께 소개했다. 그러면서 국민취업지원제와 청년내일채움공제 등을 체감형 청년정책의 대표 사례로 제시했다. 박 수석은 자화자찬이라는 비판과 관련해선 “청년의 어려움을 생각하면 문재인정부의 청년정책을 설명하는 것이 자칫 물정 모르는 소리라는 비판을 받을 수 있다”면서도 “우리의 노력과 현실이 이렇다는 것을 정확히 정리해야 다음 정부의 출발점이 정해질 수 있다는 진심에서 이 글을 기록한다”고 밝혔다. "
52,"안철수·심상정·김동연, '제3후보 단일화' 셈법은?",5시간전	,https://news.naver.com/main/read.naver?mode=LSD&mid=sec&sid1=100&oid=057&aid=0001621371,https://imgnews.pstatic.net/image/origin/057/2021/11/14/1621371.jpg?type=ofullfill106_72,100,"더불어민주당 이재명, 국민의힘 윤석열 후보 못지않게 제3 후보들의 움직임도 분주합니다. 너나없이 34년 양당 정치 교체를 내세우며 제3 후보 간 단일화 가능성도 내비쳤습니다. 거대 양당 후보에 밀려 지지율이 부진한 국민의당 안철수, 정의당 심상정 후보와 가칭 새물결 창당을 선언한 김동연 전 경제부총리. 돌파구 마련이 시급한 가운데 안철수 후보는 MBN 시사스페셜에 출연해 김동연 전 부총리와의 단일화 질문에 ""여지가 있다""고 답했습니다. - ""저도 그렇지만 다른 분들도 기득권 양당이 사실상 적폐 교대를 하는 데 대해 문제의식을 많이 가진 것 아니겠습니까"" '다른 분들'이란 심상정 후보까지 포함한다는 의미로 '제3지대 세력화'에 시동을 거는 것 아니냐는 해석도 나옵니다. 심상정 후보는 안철수 후보, 김동연 전 부총리와 ""거대 양당 체제 종식을 위한 공조가 가능하다""고 밝혔습니다. 지난 대선 때 공조했던 민주당의 이재명 후보와의 ""단일화는 가당치 않다""고 일축한 것과는 다른 모습입니다. 정치 신인인 김동연 전 부총리는 두 후보가 ""거대 정당과 같은 행태를 보였다""며 차별화를 시도하면서도 ""대화를 나누는 거야 얼마든지 있을 수 있다""며 여지를 뒀습니다. 거대 양당 대결 속에 제3지대 후보의 단일화변수가 대선판을 뒤흔들 태풍으로 떠오를지, 미풍으로 끝날지 눈길을 끌고 있습니다. "
53,"""1주택자 종부세 면제 검토""‥한국시리즈 관람",5시간전	,https://news.naver.com/main/read.naver?mode=LSD&mid=sec&sid1=100&oid=214&aid=0001159871,https://imgnews.pstatic.net/image/origin/214/2021/11/14/1159871.jpg?type=ofullfill106_72,100,"2030 청년들과 주먹인사를 나누고 기념촬영 요청에 응한 뒤 야구팬들과 나란히 줄을 서서 야구장으로 입장했습니다. ""위드코로나로 관람이 가능하다고 해서 저도 보고 싶다고 했더니 그리고 또 우리 캠프에서 (일정을) 만든 모양입니다."" 다만 야구장 응원과 집회에 차이를 두는 정부의 방역 정책에 대해선 '과학적이지 못하다'고 비판했습니다. (야구장은 1만 명 넘게 들어오는데 (정부가) 집회는 제약을 하고 있다 이런 지적이 나오는데요.) ""종부세는 세금 폭탄""이라면서 ""종부세를 재산세에 통합하거나 1주택자는 종부세를 면제하는 방안도 검토하겠다""고 약속했습니다. 또 ""공시가격 인상 속도를 낮추고 장기보유 고령층 1주택자에게 납부를 유예하는 제도도 도입하겠다""며 고가 1주택자와 다주택자들의 표심을 공략했습니다. 이에 대해 민주당에선 ""날로 심각해지는 자산 불평등에 대한 눈곱만큼의 문제의식조차 찾아볼 수 없고, 극소수 땅부자와 집부자들의 환심을 사려한다""는 비판이 나왔습니다. '허수아비 노릇은 안한다'는 김종인 전 비대위원장에 대해, 윤 후보는 ""그 분의 경륜과 의견을 존중할 텐데 어떻게 허수아비가 되겠냐""며 수습을 시도했습니다. 다만 김 전 위원장이 사실상 전권을 요구한데 대해선 ""선거조직은 다양한 국민의 참여와 전문성이 있는 팀 간에 조화를 이뤄야 한다""며 부정적인 반응을 보였습니다. "
54,"윤석열, 한국시리즈 직관 ""어릴 적부터 야구광""…2030 표심 공략",5시간전	,https://news.naver.com/main/read.naver?mode=LSD&mid=sec&sid1=100&oid=057&aid=0001621370,https://imgnews.pstatic.net/image/origin/057/2021/11/14/1621370.jpg?type=ofullfill106_72,100,"직접 경기를 관람하며 2030 표심을 공략했는데, 어릴적부터 야구광이었다는 윤 후보에게 응원하는 팀을 물어보자 근무하던 지역팀 모두를 응원했다는 답을 내놨습니다. 한국시리즈 1차전 경기가 열린 서울 고척스카이돔에 윤석열 국민의힘 후보가 국가대표 야구팀 점퍼를 입고 한국시리즈 기념 모자를 쓰고 등장했습니다. - ""위드 코로나로 관람이 가능하다고 해서… 저도 아주 오늘 굉장히 기분이 좋습니다. 날씨 좋은 가을에 우리 좀 그동안 코로나 찌들었던 국민과 함께 야구 경기 보게 돼서요."" 어느 팀을 응원하느냐는 질문에는, 검사 시절 지방 근무 때마다 야구장에서 그 지역팀을 응원했었다면서 ""어릴 적부터 야구광""이었다고 말했습니다. - ""초등학교 시절부터 학교 가면 의자 밑에다가 엉덩이 밑에 야구 글러브 깔고 앉아서 수업을 들을 정도로 야구광이었고요. 안타가 나온 모양인데 빨리 가서 좀 봅시다."" 윤 후보는 경기를 직접 관람하며, 지지세 취약층으로 꼽히는 2030 세대, 중도층과 소통 폭을 넓혔습니다. 한편, SNS를 통해서는 ""오는 22일이면 폭탄 수준의 종부세 고지서가 발송될 것""이라며, ""대통령이 되면 종부세와 재산세 통합, 1주택자 면제 등 '전면 재검토'에 들어가겠다""며 부동산 세제 개편을 거듭 예고했습니다. "
55,"""구조 조정 우려 막아야""‥'우주전략본부' 만든다",5시간전	,https://news.naver.com/main/read.naver?mode=LSD&mid=sec&sid1=100&oid=214&aid=0001159870,https://imgnews.pstatic.net/image/origin/214/2021/11/14/1159870.jpg?type=ofullfill106_72,100,"먼저 인수합병 문제로 노사갈등을 빚고 있는 대우조선해양을 찾아 노동 문제 해결에 깊은 관심을 나타냈습니다. 또, 누리호 발사를 이끈 '한국항공우주산업'을 방문해 대통령 직속 우주전략본부와 항공우주산업 단지를 만들어 우주산업을 키우겠다고 밝혔습니다. 현대중공업의 인수합병을 두고 3년 가까이 맞서 온 노조와 경영진을 잇따라 만나면서 문제를 풀기위해선 무엇보다 ""인력 구조 조정에 대한 우려를 막아야 한다""고 강조했습니다. ""문제는 아까 얘기한 불신이에요, 불신. 인수 조건에 분명하게 하든지 정부의 감독 기능을 강화하든지 하는 것은 당에서 챙겨봐 주시면 좋을 것 같습니다."" 특히 문재인 정부의 조선업 정책에 대해 ""노력은 했지만 성과로 잘 이어지진 않았다""며 ""그 부분에 대해 책임을 묻는 건 타당하다""고 거리를 뒀습니다. 이어 경남 사천의 한국항공우주산업을 방문한 이 후보는 각 부처에 분산된 업무를 통합해 대통령 직속 우주전략본부와 항공우주산업 단지를 만들겠다""는 구상을 밝혔습니다. ""사천 이 지역은 위성체 제작 중심이고 고흥지역이 발사체 중심으로 지금 구성이 돼있는데 양자를 엮는 (항공산업단지 조성이 필요하다)"" 마지막 일정으로 경남 거창의 적십자 병원을 찾아 ""국민의 건강을 국가가 책임지는 나라를 만들겠다""고 강조한 데 이어, 시민들 걷기 행사에 참여해 지지를 호소했습니다. 이에 앞서 어젯밤 예비부부와 캠핑을 함께 한 이 후보는 낙상사고로 캠핑에 참여하지 못한 배우자 김혜경 씨와 통화하기도 했습니다. 2박 3일의 첫 전국 순회 일정을 마친 이 후보는 오는 19일부터 충청 지역을 찾아가 민생 탐방을 이어갈 예정입니다. "
56,이재명 “공공의료 인력 확충 위한 공공의대 설립 고민해야”,5시간전	,https://news.naver.com/main/read.naver?mode=LSD&mid=sec&sid1=100&oid=028&aid=0002567791,https://imgnews.pstatic.net/image/origin/028/2021/11/14/2567791.jpg?type=ofullfill106_72,100,"2박 3일간의 부산·울산·경남 지역 민심 청취 일정을 소화 중인 이재명 더불어민주당 대선 후보가 14일 “공공의료 인력 확충을 위한 공공의대 설립을 충분히 고민해봐야 한다”고 밝혔다. 이 후보는 이날 경남 서북부 지역의 유일한 공공의료기관인 거창적십자병원에서 현장 간담회를 열고 “사회적 변화를 통해서 실제로 부족함을 겪고 있고 아무리 보수를 많이 준대도 (의료진을) 구할 수 없는 상황을 극복해야겠다”며 이렇게 말했다. 공공의료기관인 성남시의료원 설립 운동을 주도하며 정치권에 입문한 이 후보는 그동안 공공의료 확충을 주장했다. 이날 간담회에서도 이 후보는 “‘의료는 영업, 소위 돈벌이 영역에 속하니 공공은 손 떼라. 사람들이 죽어가도 민간에 맡겨야 된다’는 그런 암울한 왜곡된 생각 때문에 좌절감을 느꼈을 때가 있었다. 이번 코로나 사태에서도 공공의료에 대한 공동체의 투자가 적다는 것이 드러나고 있다”며 공공의료 확충 필요성을 거듭 강조했다. 이 후보는 간담회를 마친 뒤 인근에 있는 거창군청까지 걸어서 이동하며 시민들과 인사를 나눴다. 이 후보는 거창군청 앞 단상 위에 서서 “지금 환경이 너무 좋지 않다. 어디 와서 말실수 하나 안 하려고 정말 노력하는데, 요만한 걸 가지고 이만한 걸로 만들고 다른 쪽은 엄청나게 문제가 있어도 노코멘트, 나 몰라라 하는 안타까운 현실”이라고 말했다. 이어 “기울어진 운동장, 나쁜 언론환경을 이겨낼 수 있도록 작은 실천을 하면 여러 곳에서 하면 큰 변화가 온다. 태산도 티끌에서부터 시작”이라고 말하며 이날 일정을 마무리했다. "
57,"'준표형' 닉네임 쓰는 홍준표, '청년의꿈' 플랫폼 공개",5시간전	,https://news.naver.com/main/read.naver?mode=LSD&mid=sec&sid1=100&oid=018&aid=0005085906,https://imgnews.pstatic.net/image/origin/018/2021/11/14/5085906.jpg?type=ofullfill106_72,100,"[이데일리 이세현 기자] 홍준표 국민의힘 의원이 2030 청년들과 소통하기 위해 만든 온라인 플랫폼 ‘청년의꿈’이 공개됐다. 14일 2040세대를 주축으로 하는 온라인 커뮤니티형 정치참여 플랫폼인 청년의꿈이 문을 열었다. 청년들이 질문을 올리면 홍 의원이 답하는 ‘청문홍답’(靑問洪答)부터 자유, 정치, 동아리, 칼럼, 투표 등 다양한 카테고리가 개설됐다. 청년의꿈 홈페이지 소개란에는 “갈 곳 없이 방황하는 청년들은 모두 모이자. 힘들고 어려운 청년들은 이곳에서 모이자. 꿈과 희망을 잃은 청년들은 이곳에 모이자. 우리가 힘을 합치면 대한민국을 바꿀 수 있다”는 문구가 적혔다. 앞서 홍 의원이 국민의힘 대선경선에서 2030세대의 압도적 지지를 받은 것에 대한 연장선으로 이날 해당 플랫폼이 공개된 지 5시간 만에 게시글 수 4000여건을 모으는 등 뜨거운 인기를 실감케 했다. 이 플랫폼에서 닉네임 ‘준표형’을 사용하는 홍 의원은 ‘청문홍답’ 게시판에 쓴 첫 글에서 “일단 이렇게 한번 해봅시다”라고 남겼다. 앞서 홍 의원은 지난 12일 자신의 사회관계망서비스(SNS)를 통해 “청년 플랫폼 ‘청년의꿈’을 공개하고 계속 업데이트해서 청년들이 꿈과 희망을 공유하는 놀이터를 만들려고 한다”라면서 “저는 (플랫폼의)청년상담소 코너에서 청년들의 미래를 상담하는 곳만 들어갈 것이고, 나머지는 정파를 떠나 자유롭게 즐기는 공간으로 만들어 보려고 한다”고 했다. 자신의 핵심 지지층인 20·30세대 결집을 위해 발벗고 나선 것이다. 이 가운데 홍 의원은 당 대선후보인 윤석열 후보를 비롯해 이재명 더불어민주당 대선후보를 향해서도 견제를 이어가고 있다. 그는 전날 “여야 주요 후보가 모두 중요 범죄에 연루돼 있는데 아무런 진실 규명도 없이 국민들에게 선택을 강요하는 것은 참으로 잔인한 대선”이라며 “이준석 당대표가 제안한 쌍특검을 조속히 받으라”고 촉구했다. 그러면서 “이미 기초조사가 두 사건 모두 되어 있어 늦어도 연말까지는 실체적 진실이 규명될 것”이라면서 “당당하다면 두 분 다 흔쾌히 받아들일 수 있을 것이다. 그렇지 않으면 The bad The ugly(나쁜 놈, 추한 놈)가 된다”고 목소리를 높였다. "
