,title,date,news_url,image_url,category,contetns
25,"오징어게임 패러디 이준석 '프론트맨'…""정권교체, 제가 설명해드리겠다""",4시간전	,https://news.naver.com/main/read.naver?mode=LSD&mid=sec&sid1=100&oid=088&aid=0000730909,https://imgnews.pstatic.net/image/origin/088/2021/11/14/730909.jpg?type=ofullfill106_72,100,"국민의힘은 14일 오후 국회에서 열린 온라인 댓글조작 대응 프로그램 '크라켄' 시연 행사장에서 넷플릭스 글로벌 인기 드라마인 '오징어게임'처럼 연출한 홍보영상을 내보냈다. 영상에서 이준석 대표는 이영 의원을 만나 분홍색 비단주머니와 'ㄷㅈㅇ'라고 적힌 명함을 쥐어주고서 ""디지털 전문가를 찾아달라""고 말한다. 'ㄷㅈㅇ'는 디지털정당위를 줄인 '디정위'의 초성으로 보인다. 이에 이 의원은 오징어게임 속 배우 공유처럼 지하철역에서 시민들과 딱지게임을 벌여 이긴 사람들에게 'ㄷㅈㅇ' 명함을 나눠준다. 명함을 받은 시민들은 ""정권교체""라고 외치며 승합차에 올라탄다. 이어 사이버보안 전문가와 뉴미디어 전문가, 디지털 서비스 기획 전문가가 ""나라를 살리고 싶다""고 한목소리로 외친다. 여의도 국회의사당에 도착한 이들은 주위를 두리번거리며 ""어떻게 해야 대선판을 뒤집을 수 있냐""고 묻는다. "
26,"홍준표, 청년 플랫폼 띄우며 세력화…尹 ""선대위 모시려 노력 중""",4시간전	,https://news.naver.com/main/read.naver?mode=LSD&mid=sec&sid1=100&oid=003&aid=0010831561,https://imgnews.pstatic.net/image/origin/003/2021/11/14/10831561.jpg?type=ofullfill106_72,100,"[서울=뉴시스] 박준호 기자 = 국민의힘 대선 경선후보였던 홍준표 의원이 14일 청년을 결집하기 위한 플랫폼 '청년의 꿈'을 공개했다. 홍 의원은 독자 세력화에 대해선 선을 긋고 있지만 지지층 다변화를 통한 외연확장에 나선 것이라는 관측이 나온다. 홍 의원은 이날 '청년의꿈'이라는 이름의 웹사이트(theyouthdream.com)를 공개하고 청년을 끌어모으기 위한 외연확장 행보를 재개했다. 홍 의원은 이날 저녁 SNS에 ""청년의꿈을 오늘 시험 개통했다""며 ""아직 모바일 앱도 만들어야 하고 기능도 향상시켜야 하고 할일이 태산""이라고 했다. 이어 ""청년들의 놀이터 답게 각종 동아리 모임도 만들고 가입과 탈퇴도 자유로이 하게 될 것""이라며 ""청년앱과 페이스북, 유투브도 연결되도록 하여 웹서핑이 가능하도록 하겠다""고 밝혔다. 홍 의원은 ""청년들의 고뇌,제안은 언제나 함께 하도록 하겠다""며 ""함께 하면 세상을 바꿀수 있다""고 덧붙였다. 젊은 층이 즐겨 찾는 엠엘비파크, 에펨코리아 등의 온라인 커뮤니티와 웹사이트 구성이나 성격이 유사하다는 평가가 나온다. 청년의 꿈 소개란에는 ""갈 곳 없이 방황하는 청년들은 모두 모이자. 힘들고 어려운 청년들은 이곳에서 모이자. 꿈과 희망을 잃은 청년들은 이곳에 모이자. 우리가 힘을 합치면 대한민국을 바꿀 수 있다""는 문구가 올려져있다. 홍 의원은 '준표형'이라는 닉네임을 쓰며 '청문홍답(靑問洪答)'에서 첫 날부터 청년들의 질문에 직접 답변하며 소통에 나섰다. 초고령화사회에서 우리나라의 이민정책 인구정책에 대한 평가를 묻는 질문에 홍 의원은 ""다민족 정책보다 결혼하고 출산하는 사회보장제도 확립이 더 중요하다""는 견해를 밝혔다. 내년 지방선거에서 경남도지사 도전 가능성을 묻자 ""그기는 졸업했다""는 댓글을 달았고, '비리대선이 끝난 뒤 당대표에 도전해 구태청산을 하는 멋진 모습을 기대한다'는 글에는 ""당대표는 두번이나 했다""며 선을 그었다. 이밖에 웹사이트는 일반 시민이나 전문가가 쓰는 칼럼 코너, 정치 현안에 대해 토론하는 '정치게시판', 자유롭게 사진, 동영상 등을 올릴 수 있는 '동아리 갤', '짤방' 등 온라인 커뮤니티와 유사한 형태로 이뤄져있다. 이를 두고 정치권에서는 당내 경선 결과에 승복하고 백의종군을 시사한 홍 의원이 경선 과정에서 자신에게 열성적인 지지를 보여줬던 2030세대를 중심으로 사실상의 독자 세력화를 도모하고 있는 것 아니냐는 관측이 적지 않다. 홍 의원이 경선이 끝난 후에도 윤석열 대선후보를 견제하는 행보를 계속 보이면서 이 같은 관측에도 무게가 실린다. 홍 의원은 지난 8일 SNS에 ""차기 대선판이 석양의 무법자(The good.The bad .The ugly) 처럼 되어 간다. 두분 중 지면 한사람은 감옥가야 하는 처절한 대선""이라고 혹평했고, 13일에는 ""여야 주요 후보가 모두 중요 범죄에 연루 되어 있는데 아무런 진실규명도 없이 국민들에게 선택을 강요하는 것은 참으로 잔인한 대선""이라고 썼다. 한편 윤석열 대선후보는 경선이 끝난 후 홍 의원과의 회동을 추진하기 위해 접촉을 시도했지만 명확한 답변은 받지 못한 것으로 알려졌다. 윤 후보는 신동아 인터뷰에서 홍 의원의 선대위 합류 가능성에 대해 ""나도 홍준표 선배를 모시려 노력하고 있다""고 말했다． "
27,"與, '종부세 전면 재검토' 尹에 ""부자본색…불의한 주장""(종합)",4시간전	,https://news.naver.com/main/read.naver?mode=LSD&mid=sec&sid1=100&oid=001&aid=0012792152,https://imgnews.pstatic.net/image/origin/001/2021/11/14/12792152.jpg?type=ofullfill106_72,100,"(서울=연합뉴스) 고동욱 김수진 기자 = 더불어민주당은 14일 국민의힘 윤석열 대선후보가 종부세를 전면 재검토하겠다고 밝힌 것과 관련해 ""한마디로 부자본색""이라고 비판했다. 민주당 을지로위원장인 진성준 의원은 이날 페이스북에서 ""윤 후보가 국민의 1.7%에 해당하는 집부자, 땅부자를 위한 종부세 감면론을 제기했다""며 이같이 밝혔다. 진 의원은 ""날로 심각해지는 자산 불평등과 격차에 대한 눈곱만큼의 문제의식조차 찾아볼 수 없고, 노블레스 오블리주라는 사회적 책임의식도 느낄 수 없는 불의한 주장""이라며 ""오로지 극소수 땅부자 집부자들과 기득권 언론의 환심을 사려는 것""이라고 주장했다. 이어 ""윤 후보는 집값 폭등에 절망하고 분노하는 2030 청년과 신혼부부, 무주택 서민들의 처지를 짐작이나 하느냐""며 ""그들의 고통을 조금이라도 이해한다면 부동산 부자 감세론을 즉각 철회하기 바란다""고 말했다. 민주당 선대위 대변인 신현영 의원은 서면 브리핑을 통해 ""윤 후보는 '똘똘한 한 채'를 둘러싼 투기 열풍 자극으로 부동산 시장에 잘못된 나비효과를 어떻게 방지할 수 있을지 먼저 답변해 보라""고 지적했다. 이어 ""선심성 공약남발을 당장 중지하라""며 ""정책에 관한 소신이나 철학도 없이, 게다가 맥락도 없이 이런 잘못된 시그널을 던진다면 결국 시장에 혼란을 초래하게 될 뿐""이라고 꼬집었다. 신동근 의원도 페이스북에서 ""윤 후보 주장대로라면 다주택자 등 부동산 부자들이 부동산을 갖는 것에 부담을 느낄 이유가 없다""며 ""토건족들이 기승을 부릴 완벽한 여건이 조성된다""고 비판했다. 신 의원은 ""윤 후보가 꿈꾸는 나라라는 게 고작 부동산 부자들의 천국이란 말이냐""며 ""부동산을 잡기는커녕 무주택자 등 부동산 취약계층을 잡을 것""이라고 주장했다. 앞서 윤 후보는 이날 페이스북에서 ""대통령이 되면 종부세를 전면 재검토할 것""이라면서 ""종부세를 재산세에 통합하거나 1주택자에 대해서는 면제하는 방안을 검토하겠다""고 밝혔다. "
28,"윤석열 48.3% 이재명 32.2%…""尹 70세 이상 71.6%, 李 호남 59%""",4시간전	,https://news.naver.com/main/read.naver?mode=LSD&mid=sec&sid1=100&oid=088&aid=0000730908,https://imgnews.pstatic.net/image/origin/088/2021/11/14/730908.jpg?type=ofullfill106_72,100,"여론조사업체 PNR(피플네트웍스리서치)이 뉴데일리와 시사경남 의뢰로 지난 12, 13일 이틀에 걸쳐 전국 18세 이상 1천2명을 대상으로 대선 후보 적합도를 조사한 결과가 14일 공개됐다. 이 조사의 표본오차는 95% 신뢰수준에 ±3.1%포인트(p)인데, 이같은 다자대결에서 윤석열 후보와 이재명 후보의 격차는 16.1%p로, 즉 오차범위 밖인 것으로 나타났다. 이는 1주 전인 7일 공개된 PNR의 첫 조사(11월 5, 6일 이틀 동안 전국 18세 이상 1천5명 대상 조사, 표본오차는 95% 신뢰수준에 ±3.1%p)와 비교해 윤석열 후보와 이재명 후보 둘 다 지지도가 상승했다. 1주 전 조사의 경우 윤석열 후보는 45.8%를 차지, 1주 후 공개된 이번 조사에서는 48.3%로 2.5%p 상승했다. 또한 같은 기간 이재명 후보도 30.3%에서 32.2%로 1.9%p 상승했다. 1주 전 조사에서는 없음이 9.2%, 잘모름이 2.3%였는데, 1주 후 조사에서 없음은 1.8%p, 잘모름은 1.5%p 각각 감소한 것. 지역별로 보면 윤석열 후보가 호남을 뺀 전 지역에서 이재명 후보를 이겼다. 1주 전 조사에서도 이재명 후보는 호남에서만 윤석열 후보를 눌렀다. 이번 조사에서 윤석열 후보는 대구경북 및 대전세종충청에서 가장 많은 각 55.2%(두 지역 동률)의 지지를 얻었다. 이재명 후보는 광주전라에서 가장 많은 59.0%의 지지를 받았다. 연령별로 보면 윤석열 후보가 40대를 뺀 전 연령층에서 이재명 후보에 우세했다. 1주 전 조사에서도 이재명 후보는 40대에서만 윤석열 후보를 앞서는 지지도를 보였다. 이번 조사에서 윤석열 후보는 70세 이상에서 가장 많은 71.6%의 지지를 얻었다. 이재명 후보는 40대로부터 가장 많은 47.3%의 지지를 받았다. 이 조사는 휴대전화 RDD 85%, 유선전화 RDD 15% 비율로 피조사자를 선정했고, 최종 응답률은 6.5%였다. "
29,"이준석, ‘오징어게임’ 프론트맨 이병헌 변신 “정권교체”[이슈픽]",4시간전	,https://news.naver.com/main/read.naver?mode=LSD&mid=sec&sid1=100&oid=081&aid=0003229845,https://imgnews.pstatic.net/image/origin/081/2021/11/14/3229845.jpg?type=ofullfill106_72,100,"넷플릭스 오리지널 드라마 ‘오징어게임’의 패러디가 여전히 인기인 가운데, 이준석 국민의힘 대표가 ‘오징어게임’ 프론트맨을 연기한 배우 이병헌으로 분했다. 14일 국민의힘 디지털정당위원회(위원장 이영 의원)가 제작한 오징어게임 패러디 홍보영상물이 온라인상에서 화제를 모았다. 해당 영상은 이날 국회에서 열린 온라인 댓글조작 대응 프로그램 ‘크라켄’ 시연 행사장에서 처음 공개됐다. 이 영상은 국민의힘 디지털정당위원회가 대선을 앞두고 제작한 홍보영상물로, 국민의힘 공식 유튜브인 오른소리TV를 통해 확인할 수 있다. 영상에서 이준석 대표는 이 의원을 만나 분홍색 비단주머니와 ‘ㄷㅈㅇ’라고 적힌 명함을 쥐여주며 “디지털 전문가를 찾아달라”고 요청한다. ‘ㄷㅈㅇ’는 디지털정당위를 축약한 ‘디정위’의 초성으로 해석된다. 이 의원은 오징어게임 속 배우 공유처럼 지하철역에서 시민들과 딱지게임을 벌여서 이긴 사람들에게 ‘ㄷㅈㅇ’ 명함을 건네고, 이들은 “정권교체”를 암호로 외치며 승합차에 올라탄다. 이어 사이버보안 전문가와 뉴미디어 전문가, 디지털 서비스 기획 전문가까지 “나라를 살리고 싶다”고 한 목소리로 외친다. 여의도 국회의사당에 도착한 이들은 주위를 두리번거리며 “어떻게 해야 대선판을 뒤집을 수 있냐”고 묻고, ‘프론트맨’ 가면을 쓴 이 대표가 “제가 설명해드리겠다”며 등장한다. 이어서 ‘디지털 대선을 위한 최강의 디지털 전문가들이 모였다’는 자막이 나오며 영상은 끝이 난다. 앞서 제주특별자치도 소방안전본부 역시 11월 불조심 강조의 달을 맞아 도민 공감과 화재예방 분위기 조성을 위해 ‘오징어게임’을 패러디한 4부작 카드뉴스를 연재했다. 최근 제주특별자치도 소방안전본부는 11월 불조심 강조의 달을 맞아 도민 공감과 화재예방 분위기 조성을 위해 특별 이벤트를 추진 중이다. 제주소방안전본부는 겨울철 도민의 관심과 참여를 유도하기 위해 인기 드라마인 ‘오징어게임’을 패러디한 4부작 카드뉴스를 본부 소셜네트워크(SNS)를 통해 지난 9일부터 연재 중이다. 제주안전체험관 체험자 중 불조심게임 참가를 희망하는 자를 대상으로 소방관과 딱지치기 대결을 펼쳐 승리하면 소화기 모양이 새겨진 달고나 세트를 증정하는 이벤트를 하고 있다. 고정배 제주소방안전본부 예방지도팀장은 “화재발생 위험이 증가하는 겨울철을 대비해 화재예방 분위기를 조성하고 불조심 강조의 달에 대한 공감대를 형성하기 위해 이벤트를 마련했다”면서 “도민들의 많은 관심과 참여를 부탁한다”고 밝혔다. 한편 ‘오징어 게임’은 지난 9월 23일 전 세계 넷플릭스 드라마 시리즈 부문 정상에 오른 이후 정상 자리를 지켰다. 올해 넷플릭스에서 공개된 작품 중 가장 오래 1위를 했다. ‘오징어 게임’의 46주 기록은 지금까지 넷플릭스에서 가장 오래 1위를 유지한 ‘퀸스 갬빗’과 같은 기록이다. "
30, 이준석 비단주머니엔 유세차 앱·정책 웹드라마,4시간전	,https://news.naver.com/main/read.naver?mode=LSD&mid=sec&sid1=100&oid=032&aid=0003110067,https://search.naver.com/search.naver?where=image&sm=tab_jum&query=naver#,100,"이준석 국민의힘 대표가 윤석열 대선 후보에게 건넨 ‘비단주머니’에는 유세차 애플리캐이션(앱), 정책 웹드라마, 후보 홍보 영상 공모전 등 20·30세대를 공략하는 아이디어가 담긴 것으로 14일 확인됐다. 유권자의 적극적 참여를 유도하는 저비용·고효율의 ‘스마트 선대위’ 구상이다. 이 대표는 지난 6일 서울 마포구의 한 카페에서 윤 후보와 오찬 회동을 하면서 이 같은 내용의 본선 전략을 공유했다. 유세차 앱은 유권자들이 유세차 위치를 앱으로 검색한 뒤 찾아와 발언대로 활용하는 게 핵심이다. 발언은 당 유튜브인 ‘오른소리’에 중계하고, 일부는 후보 홍보 영상으로 활용할 계획이다. ‘비단주머니’에는 후보 홍보 영상 공모전도 담겼다. 지난 7월 당 대변인 공개선발 토론배틀 ‘나는 국대(국민의당 대변인)다’처럼 20·30세대의 참여를 이끌어내겠다는 구상이다. 정책 웹드라마를 제작하는 아이디어도 검토 중이다. 이 대표는 이날 국회 의원회관에서 ‘20대 대선 여론조작 방지를 위한 온라인싸드 크라켄 공개’ 회견을 열고 “여론조작 시도는 민심을 왜곡하고 민주주의에 중대한 도전이 되므로 엄격히 다루고자 한다”고 크라켄 도입 취지를 설명했다. 그는 “2012년 새누리당은 댓글부대로 의심받는 십알단(십자군 알바단)이 박근혜 당시 대선 후보를 홍보하고자 여론조작을 획책했다는 의심을 받았다”고 말했다. 또 “문재인 정부는 김경수 지사가 드루킹의 제안으로 댓글부대를 운용하려다가 정부 정통성에 흠집을 냈다”고 지적했다. 당 디지털정당위원회 위원장인 이영 의원은 크라켄을 “부정 댓글과 공감(추천)을 모니터링하는 시스템”이라고 설명했다. 크라켄은 국민의힘, 더불어민주당 등 주요 키워드로 포털사이트 등의 기사와 댓글을 크롤링(인터넷상의 정보를 자동화된 방법으로 수집·분류하는 기술)한다. 수집된 데이터는 인공지능(AI)의 분석으로 이상 행위를 살피는 데 쓰인다. 이 대표는 “반대 의견을 수집하는 게 아니다. 공명선거 이상의 목적으로 활용하지 않는다”고 했다. "
31," 이재명, 청년·여성 정책 ‘갈팡질팡 행보’",4시간전	,https://news.naver.com/main/read.naver?mode=LSD&mid=sec&sid1=100&oid=032&aid=0003110066,https://search.naver.com/search.naver?where=image&sm=tab_jum&query=naver#,100,"이재명 더불어민주당 대선 후보(57)가 14일까지 사흘 동안 진행한 부산·울산·경남 민생 대장정은 ‘청년과 여성’ 표심 얻기로 요약된다. 이 후보는 지난 13일 “공무원시험에서 남성이 혜택을 본다”고 여성할당제를 옹호했다. 최근 ‘반(反)페미니즘’ 글을 공유했다 비판에 직면하자 진화에 나선 모양새다. 이날은 “청년세대들은 지방에서 기회를 얻기 어렵다고 판단해 수도권으로 몰리는 악순환이 반복된다”고 했다. 대선 승부의 열쇠를 쥔 2030세대 표심을 야당 후보에게 빼앗겨선 안 된다는 위기감이 반영된 행보로 풀이된다. 이 후보는 부산·울산·경남 지역 방문 이틀째인 13일 스튜디오가 마련된 매타버스(매주 타는 민생버스) 안에서 지역청년 4명과 ‘국민반상회’를 열었다. 그는 여성할당제에 대해 “20대 남성이 여성할당제 때문에 피해를 봤다며 폐지하자고 하지만, 실제 여성을 위한 할당제는 거의 없고 성(性)할당제”라고 말했다. 이어 “특정 성이 30% 이하로 내려가지 않게 하자고 해서 실제로 누가 혜택을 보느냐(봤더니) 공무원시험에서 남성이 혜택을 본다”고 말했다. 울산 청년들과의 대화(12일)에서도 “남녀의 전 생애를 놓고 보면 여성이 너무 피해를 받고 있다”고 말했다. 2030세대 남성의 표심을 얻는 데 집중하면서 같은 세대의 여성 표심을 소홀히 했다는 비판을 의식한 행보로 풀이된다. 이 후보는 9일 사회관계망서비스(SNS)에서 여성가족부를 ‘평등가족부’로 개편해야 한다고 제안했고, 8일에는 당 중앙선거대책위원회 비공개 회의에서 “민주당이 각종 페미 정책으로 남성들을 역차별했다”는 내용이 담긴 글을 의원들과 공유했다. 이 때문에 지지세가 취약한 2030여성들의 반발을 샀다는 비판이 일었다. 이 후보는 13일엔 경남 거제 옥계해수욕장 오토캠핑장에서 예비부부와 만난 행사에서는 최근 낙상사고를 당한 부인 김혜경씨와 예정에 없던 통화를 했다. 그는 “제가 때려서 그렇다(아내가 다쳤다)는 소문이 있다는데, 어처구니가 없다”며 “누가 (유언비어 유포를) 일부러 한 것”이라고 말했다. 김씨는 통화에서 “(낙상사고 당시) 잠시 기절했었는데 눈 뜨는 순간 우리 남편이 ‘이 사람아’ 하고 울고 있더라. 되게 뭉클했다”고 회상했다. 민주당은 사고 당시 이 후보가 119안전신고센터에 신고한 녹취록도 공개했다. 이 후보는 이날 매타버스 안에서 한국항공우주산업(KAI) 소속 20~30대 연구원들과 퀴즈 대회를 한 뒤 “지방 소외가 생각보다 심각하다”며 “청년세대들이 지방에서 기회를 얻기 어렵다고 판단해 수도권으로 몰리는 악순환이 반복된다”고 말했다. 그는 “청년문제뿐 아니라 국토균형발전 문제도 중요한 과제라 생각한다”고 덧붙였다. 앞서 이 후보는 대우조선소 경영진과 만나 현대중공업의 대우조선해양 인수·합병 문제에 대해 “노동자 구조조정이 대대적으로 이뤄져 일자리를 잃지 않겠느냐는 우려를 막아야 한다”고 말했다. 이 후보는 “(인수·합병으로) 하청업체 홀대 등의 우려를 막기 위해 (관련 사항을) 협상 조건에 명확히 하거나 정부 감독기구를 강화하는 방향을 당이 챙겼으면 한다”고 말했다. 이 후보는 대우조선소 노조·시민대책위원회와의 만남에서도 “노동자가 걱정하는 구조조정 문제에 각별한 관심을 두겠다”고 약속했다. "
32,초반 열세 극복할 ‘이재명의 3가지 숙제’ 민주당에 달렸다,4시간전	,https://news.naver.com/main/read.naver?mode=LSD&mid=sec&sid1=100&oid=032&aid=0003110065,https://imgnews.pstatic.net/image/origin/032/2021/11/14/3110065.jpg?type=ofullfill106_72,100,"이재명 더불어민주당 대선 후보(57)와 민주당이 ‘운명의 한 달’을 맞이하고 있다. 지난달 10일 후보 선출 후 ‘역벤션’을 안고 출발한 이 후보로선, 윤석열 국민의힘 대선 후보를 추격해야 하는 입장에서 대선 본선을 출발했다. 당내에선 한 달 내에 흐름을 바꾸지 못할 경우 연말연시를 지나면서 어려운 싸움이 될 것이란 우려가 적지 않다. 민주당의 ‘한 달’이 이 후보가 추격의 발판을 마련하기 위한 시간이 될 것으로 보인다. 이 후보가 지난달 말 정부의 재난지원금 지급을 언급한 뒤 재난지원금은 내년도 예산정국 최대 화두로 떠올랐다. 민주당이 ‘전 국민 일상회복 지원금’을 당론으로 정해 올해 초과세수분을 내년에 걷어 재원을 마련하자는 방법론까지 제시했지만, 정부는 재정 여력이 부족하고 세수 유예도 관련법상 받아들이기 어렵다며 반대하고 있다. 국회 예산결산특별위원회는 오는 16일부터 내년도 예산안 세부 심사를 시작한다. 예산안 처리 시한은 다음달 2일이다. 민주당은 이 기간 전 국민 지원금에 대한 유의미한 성과를 내야 한다. 전 국민 지원금은 ‘이재명표 공약’인 전 국민 기본소득과 유사하지만, 최근 여론조사에서는 전 국민 지원금이 필요하다는 의견이 높지 않다. 당내 한 중진 의원은 통화에서 “후보가 지원금에 대한 입장을 더 내지 않고 논의를 당과 국회에 맡기는 식으로 나가야 할 것 같다”고 말했다. 다만 민주당이 야당·정부와 파열음만 내고 지원책을 마련하지 못한다면, 당은 ‘무능’ 프레임에 갇히고 이 후보의 ‘유능한 행정가’ 이미지도 빛바랠 가능성이 있다. 민주당은 국민의힘이 불을 지핀 ‘특별검사 여론전’에도 대응해야 한다. 국민의힘과 윤 후보는 꾸준히 대장동 개발특혜 의혹 특검을 제기해왔다. 이 후보가 지난 10일 관훈클럽 초청 토론회에서 “검찰 수사가 미진할 때 (특검) 필요성에 대해 공감한다”고 답하며 특검 도입 논의에 불이 붙었다. 송영길 대표는 12일 선거대책위원회 회의에서 “단 한 번도 검찰 수사 없이 특검이 된 적 없다”고 말했다. 다만 관련 의혹으로 구속된 김만배씨와 남욱 변호사의 기소 여부는 구속 시한 등을 감안하면 늦어도 이달 내 결정될 것으로 보인다. 야권은 이 시점부터 특검 도입 공세를 높일 것으로 보인다. 민주당은 대장동 개발 민간사업자들이 곽상도 전 의원, 박영수 전 특검 등에게 주고받은 돈을 더 강조할 것으로 보인다. 그러나 국민적 관심사는 이 후보가 성남시장 시절 유동규 전 성남도시개발공사 기획본부장(구속 기소)을 통해 민간사업자들의 이익 취득을 방조했다는 배임 혐의 부분에 쏠려 있다. 야권이 이 후보 의혹을 제기하는 것만으로도 지지율에 악영향을 줄 수 있어 지도부는 대응에 고심하고 있다. 민주당은 4차례에 걸쳐 선대위 인선을 진행했다. 현직 장관을 제외한 국회의원 163명이 모두 배치됐지만, 실무진 배치가 완료되지 않아 이 후보와 선대위 간 화학적 결합이 이뤄지지 않았다는 평가가 많다. 이 후보의 언론 대응과 전략, 논란성 발언, 상임선대위원장인 송영길 대표와의 역할 분담 문제 등이 불협화음의 결과라는 지적이 나온다. 경선 경쟁자였던 이낙연 전 대표 측과의 앙금도 완전 해소되지 않았다. 민주당이 이달 내로 선대위 실무자급 인선을 마무리해 안정화를 이뤄내는 것이 과제다. 중도층과 청년, 여성층 지지를 확보하기 위한 선대위 인사 영입도 난제다. 민주당은 지난 12일 원혜영 전 의원을 후보 직속 국가인재위원회 위원장으로 세우며 인재 영입에 박차를 가할 것이라고 밝혔다. 한 초선 의원은 “선대위 외부 인사 영입은 총선 때처럼 영입 인사에게 지역구와 조직을 내줄 수 없기 때문에 더 어려운 점이 있다”고 말했다. "
